{"$schema":"http://json-schema.org/draft-07/schema#","properties":{"auth":{"type":"string"},"capabilities":{"items":{"type":"string"},"type":"array"},"counts":{"type":"object"},"description":{"type":"string"},"exec":{"type":"string"},"inputModes":{"items":{"type":"string"},"type":"array"},"keys":{"type":"string"},"lang":{"const":"al:1"},"name":{"type":"string"},"outputModes":{"items":{"type":"string"},"type":"array"},"routes":{"type":"object"},"skills":{"type":"array"},"tools":{"type":"integer"},"url":{"format":"uri","pattern":"^https://","type":"string"},"version":{"type":"string"},"views":{"type":"integer"}},"required":["name","version","lang","url","description","capabilities","skills","inputModes","outputModes","auth","keys","exec"],"title":"ai-workspace agent.json","type":"object"}